{
  "event_id": "evt-ref-0001",
  "kind": "REFERRAL_CREATED",
  "occurred_at": "2026-09-23T11:00:00+08:00",
  "subject_id": "patient-0427",
  "version": 1,
  "payload": {
    "referral_id": "ref-0001",
    "from_organization_id": "hospital-a",
    "to_organization_id": "hospital-b",
    "consent_id": "consent-0001",
    "scope": ["sub-0920-01", "mat-0922-01", "plan-0922-01"],
    "created_at": "2026-09-23T11:00:00+08:00"
  }
}
