{
  "event_id": "evt-auth-0001",
  "kind": "PROXY_AUTHORIZATION_VERIFIED",
  "occurred_at": "2026-09-19T18:00:00+08:00",
  "subject_id": "patient-0427",
  "version": 1,
  "payload": {
    "authorization_id": "auth-0001",
    "proxy_id": "family-zhang-02",
    "patient_subject_id": "patient-0427",
    "relationship": "daughter",
    "scope": ["submit", "upload_material"],
    "verification_method": "in_person_id_check",
    "verified_at": "2026-09-19T18:00:00+08:00",
    "expires_at": "2026-12-31T23:59:59+08:00"
  }
}
